{
  "$schema": "./help-map.schema.json",
  "version": 1,
  "basePath": "/docs",
  "defaultLocale": "en",
  "locales": ["en", "hu", "de", "es", "fr", "tlh"],
  "entries": {
    "getting-started": { "path": "getting-started", "hash": null, "description": "Install and first run" },
    "setup-wizard": { "path": "setup-wizard", "hash": null, "description": "First-boot wizard" },
    "first-hour": { "path": "first-hour", "hash": null, "description": "Guided first hour in the running app" },
    "concepts": { "path": "concepts", "hash": null, "description": "Core mental model" },

    "daily.home": { "path": "daily/home", "hash": null, "description": "Home widget grid" },
    "daily.conversations": { "path": "daily/conversations", "hash": null, "description": "Chat with agents" },
    "daily.conversations.folders": { "path": "daily/conversations", "hash": "working-folders", "description": "Conversation working folders" },
    "daily.conversations.plan": { "path": "daily/conversations", "hash": "plan-mode", "description": "Plan first before tools" },
    "daily.conversations.tools": { "path": "daily/conversations", "hash": "tool-trace", "description": "Streaming tool trace and file diffs" },
    "daily.board": { "path": "daily/board", "hash": null, "description": "Board / kanban" },
    "daily.projects": { "path": "daily/projects", "hash": null, "description": "Projects and stages" },
    "daily.projects.folders": { "path": "daily/projects", "hash": "working-directories", "description": "Type and project working directories" },
    "daily.projects.wiki": { "path": "daily/projects", "hash": "wiki-auto-update", "description": "Project wiki auto-update" },
    "daily.search": { "path": "daily/search", "hash": null, "description": "Unified search" },

    "agents.overview": { "path": "agents/overview", "hash": null, "description": "Agents list and lifecycle" },
    "agents.configure": { "path": "agents/configure", "hash": null, "description": "Create and configure agents" },
    "agents.identity": { "path": "agents/identity-workspace", "hash": null, "description": "IDENTITY and workspace files" },
    "agents.voice": { "path": "agents/voice", "hash": null, "description": "Voice profile overview" },
    "agents.voice.presets": { "path": "agents/voice", "hash": "presets", "description": "Built-in voice presets" },
    "agents.voice.dimensions": { "path": "agents/voice", "hash": "dimensions", "description": "Six voice dimensions" },
    "agents.teams": { "path": "agents/teams", "hash": null, "description": "Teams and delegation" },
    "agents.runs": { "path": "agents/runs", "hash": null, "description": "Runs and Mission Control" },
    "agents.forge": { "path": "agents/forge", "hash": null, "description": "Forge soul proposals" },
    "agents.autonomy": { "path": "agents/autonomy", "hash": null, "description": "Autonomy levels" },

    "automation.skills": { "path": "automation/skills", "hash": null, "description": "Skills catalogue" },
    "automation.skills.import": { "path": "automation/skills", "hash": "import-roots", "description": "Import extra skill roots" },
    "automation.tools": { "path": "automation/tools", "hash": null, "description": "Tools catalogue" },
    "automation.scheduler": { "path": "automation/scheduler", "hash": null, "description": "Scheduler jobs" },
    "automation.pipelines": { "path": "automation/pipelines", "hash": null, "description": "Pipelines" },
    "automation.research": { "path": "automation/research", "hash": null, "description": "Research jobs" },
    "automation.proactive": { "path": "automation/proactive", "hash": null, "description": "Proactive assistant" },
    "automation.self-learning": { "path": "automation/self-learning", "hash": null, "description": "Self-learning and skill evolution" },

    "knowledge.memory": { "path": "knowledge/memory", "hash": null, "description": "Five-tier memory" },
    "knowledge.base": { "path": "knowledge/knowledge-base", "hash": null, "description": "Knowledge wiki" },
    "knowledge.design": { "path": "knowledge/design", "hash": null, "description": "Design canvases" },
    "knowledge.documents": { "path": "knowledge/documents", "hash": null, "description": "Documents" },
    "knowledge.client-wiki": { "path": "knowledge/client-wiki", "hash": null, "description": "Project wiki" },
    "knowledge.meetings": { "path": "knowledge/meetings", "hash": null, "description": "Meetings" },

    "studio.overview": { "path": "studio", "hash": null, "description": "Studio — local production engines" },
    "studio.hyperframes": { "path": "studio/hyperframes", "hash": null, "description": "Hyperframes HTML→MP4" },
    "studio.videouse": { "path": "studio/videouse", "hash": null, "description": "Video Use footage→MP4" },
    "automation.browser-use": { "path": "automation/browser-use", "hash": null, "description": "Headless browser_* and optional logged-in Chrome sidecar" },
    "automation.opencode": { "path": "automation/opencode", "hash": null, "description": "Embedded OpenCode coding engine and web terminal" },
    "automation.browser-use.headless": { "path": "automation/browser-use", "hash": "headless", "description": "Headless Playwright browser_* tools" },
    "automation.browser-use.sidecar": { "path": "automation/browser-use", "hash": "sidecar", "description": "Logged-in Chrome CLI sidecar" },
    "automation.tools.browser": { "path": "automation/tools", "hash": "browser", "description": "Headless browser tools in the catalogue" },

    "communication.channels": { "path": "communication/channels", "hash": null, "description": "Channels overview" },
    "communication.telegram": { "path": "communication/telegram", "hash": null, "description": "Telegram bot" },
    "communication.telegram.threads": { "path": "communication/telegram", "hash": "threads", "description": "Telegram conversation threads" },
    "communication.telegram.approval": { "path": "communication/telegram", "hash": "approval-ping", "description": "Approve or deny tools from Telegram" },
    "communication.a2a": { "path": "communication/a2a", "hash": null, "description": "A2A protocol" },

    "ai.providers": { "path": "ai/providers", "hash": null, "description": "AI providers" },
    "ai.providers.effort": { "path": "ai/providers", "hash": "effort-by-provider", "description": "How each provider applies the reasoning-effort level" },
    "ai.routing": { "path": "ai/routing-budget", "hash": null, "description": "Routing and budget" },
    "ai.prompts": { "path": "ai/prompts", "hash": null, "description": "Prompt system" },
    "ai.mcp": { "path": "ai/mcp", "hash": null, "description": "MCP servers" },
    "ai.media": { "path": "ai/media", "hash": null, "description": "Media backends — Magnific, Higgsfield, fal, HeyGen" },
    "ai.media.compare": { "path": "ai/media", "hash": "compare", "description": "Which media backend to connect" },

    "admin.users": { "path": "admin/users", "hash": null, "description": "Users and permissions" },
    "admin.secrets": { "path": "admin/secrets", "hash": null, "description": "Secrets and API keys" },
    "admin.connections": { "path": "admin/connections", "hash": null, "description": "External system connections" },
    "admin.settings": { "path": "admin/settings", "hash": null, "description": "Settings map" },
    "admin.notifications": { "path": "admin/notifications", "hash": null, "description": "Notification preferences and channels" },
    "admin.extensions": { "path": "admin/extensions", "hash": null, "description": "Extension packs" },
    "admin.nodes": { "path": "admin/nodes", "hash": null, "description": "Remote nodes" },
    "admin.hands": { "path": "admin/hands", "hash": null, "description": "Paired hands / computer use" },
    "admin.backup": { "path": "admin/backup", "hash": null, "description": "Backup and restore" },
    "admin.ingress": { "path": "admin/ingress", "hash": null, "description": "Ingress Cloudflare tunnel" },
    "admin.data-port": { "path": "admin/data-port", "hash": null, "description": "Data import and export" },
    "admin.security": { "path": "admin/security-privacy", "hash": null, "description": "Security and privacy" },
    "admin.observability": { "path": "admin/observability", "hash": null, "description": "Observability and ops" },

    "deploy.native": { "path": "deploy/native", "hash": null, "description": "Native install" },
    "deploy.docker": { "path": "deploy/docker", "hash": null, "description": "Docker" },
    "deploy.kubernetes": { "path": "deploy/kubernetes", "hash": null, "description": "Kubernetes" },
    "deploy.multi-instance": { "path": "deploy/multi-instance", "hash": null, "description": "Multiple instances" },
    "deploy.cli": { "path": "deploy/cli", "hash": null, "description": "CLI reference" },
    "deploy.configuration": { "path": "deploy/configuration", "hash": null, "description": "Configuration" },

    "reference.glossary": { "path": "reference/glossary", "hash": null, "description": "Glossary" },
    "reference.faq": { "path": "reference/faq", "hash": null, "description": "FAQ" },
    "reference.architecture": { "path": "reference/architecture", "hash": null, "description": "Architecture pointer" }
  }
}
